{
  "$schema": "https://json-schema.org/draft/2020-12/schema",
  "$id": "urn:pto-isa:agentic-circuit:schema:pto-trace:0.2",
  "title": "PTO Trace 0.2",
  "type": "object",
  "additionalProperties": false,
  "required": ["schema", "version", "contract_epoch", "metadata", "records"],
  "properties": {
    "schema": {"const": "pto-trace"},
    "version": {"const": "0.2"},
    "contract_epoch": {"const": "0.2"},
    "metadata": {"$ref": "#/$defs/metadata"},
    "records": {
      "type": "array",
      "items": {"$ref": "#/$defs/record"}
    }
  },
  "$defs": {
    "uint64": {
      "type": "integer",
      "minimum": 0,
      "maximum": 18446744073709551615
    },
    "sha256": {
      "type": "string",
      "pattern": "^sha256:[0-9a-f]{64}$"
    },
    "metadata": {
      "type": "object",
      "additionalProperties": false,
      "properties": {
        "producer": {"type": "string", "minLength": 1},
        "pto_identity": {"type": "string", "minLength": 1},
        "source_program": {"type": "string", "minLength": 1},
        "address_spaces": {
          "type": "array",
          "items": {"type": "string", "minLength": 1},
          "uniqueItems": true
        },
        "data_layout": {"type": "string", "minLength": 1},
        "record_count": {"$ref": "#/$defs/uint64"},
        "content_hash": {"$ref": "#/$defs/sha256"}
      }
    },
    "record": {
      "type": "object",
      "additionalProperties": false,
      "required": ["sequence_id", "opcode", "operands", "dependencies", "attributes"],
      "properties": {
        "sequence_id": {"$ref": "#/$defs/uint64"},
        "opcode": {"type": "string", "pattern": "^[A-Za-z_][A-Za-z0-9_.]*$"},
        "operands": {
          "type": "array",
          "items": {"$ref": "#/$defs/operand"}
        },
        "dependencies": {
          "type": "array",
          "items": {"$ref": "#/$defs/uint64"},
          "uniqueItems": true
        },
        "attributes": {
          "type": "object",
          "additionalProperties": {"$ref": "#/$defs/jsonValue"}
        },
        "issue_time": {"$ref": "#/$defs/uint64"},
        "source": {"$ref": "#/$defs/source"}
      }
    },
    "operand": {
      "oneOf": [
        {"$ref": "#/$defs/immediateOperand"},
        {"$ref": "#/$defs/idOperand"},
        {"$ref": "#/$defs/addressOperand"},
        {"$ref": "#/$defs/recordResultOperand"}
      ]
    },
    "immediateOperand": {
      "type": "object",
      "additionalProperties": false,
      "required": ["kind", "type", "value"],
      "properties": {
        "kind": {"const": "immediate"},
        "type": {"type": "string", "minLength": 1},
        "value": {"$ref": "#/$defs/jsonScalar"}
      }
    },
    "idOperand": {
      "type": "object",
      "additionalProperties": false,
      "required": ["kind", "id"],
      "properties": {
        "kind": {"enum": ["buffer", "tile", "symbol"]},
        "id": {"type": "string", "minLength": 1}
      }
    },
    "addressOperand": {
      "type": "object",
      "additionalProperties": false,
      "required": ["kind", "space", "value"],
      "properties": {
        "kind": {"const": "address"},
        "space": {"type": "string", "minLength": 1},
        "value": {"$ref": "#/$defs/uint64"}
      }
    },
    "recordResultOperand": {
      "type": "object",
      "additionalProperties": false,
      "required": ["kind", "sequence_id", "result_index"],
      "properties": {
        "kind": {"const": "record_result"},
        "sequence_id": {"$ref": "#/$defs/uint64"},
        "result_index": {"type": "integer", "minimum": 0}
      }
    },
    "source": {
      "type": "object",
      "additionalProperties": false,
      "required": ["file", "line", "column"],
      "properties": {
        "file": {"type": "string", "minLength": 1},
        "line": {"type": "integer", "minimum": 1},
        "column": {"type": "integer", "minimum": 1}
      }
    },
    "jsonScalar": {
      "type": ["string", "number", "integer", "boolean", "null"]
    },
    "jsonValue": {
      "oneOf": [
        {"$ref": "#/$defs/jsonScalar"},
        {"type": "array", "items": {"$ref": "#/$defs/jsonValue"}},
        {"type": "object", "additionalProperties": {"$ref": "#/$defs/jsonValue"}}
      ]
    }
  }
}
