{"contract_epoch":"0.2","metadata":{"content_hash":"sha256:4ad35c1b1106c2cae0b56e0c7233a019d85e3387653e6e886f3765e0a966f179","data_layout":"davincioo-tile-address-v1","producer":"davincioo@e73633301cabed0d871ea5ff66e76a91df870aeb","pto_identity":"pto-isa@f6d0567c1cae2d6a7b0ebaf7ad0e3b93f8a39da3","record_count":2,"source_program":"examples/beginner_matmul"},"records":[{"attributes":{"davincioo":{"block_idx":0,"input_tiles":[],"operand_roles":["scalar_input","output_tile"],"output_tiles":[{"address":"0x0","dtype":"float32","layout":"outer=col_major,inner=row_major,fractal_size=512","shape":[64,256]}],"scalar_inputs":[{"dtype":"uint64","value":"0"}]}},"dependencies":[],"opcode":"TASSIGN","operands":[{"kind":"immediate","type":"uint64","value":"0"},{"id":"block/0/tile/0x0","kind":"tile"}],"sequence_id":0},{"attributes":{"davincioo":{"block_idx":0,"input_tiles":[{"address":"0xfffd835fd000","dtype":"float32","layout":"ND","shape":[1,1,1,64,256]}],"operand_roles":["input_tile","output_tile"],"output_tiles":[{"address":"0x0","dtype":"float32","layout":"outer=col_major,inner=row_major,fractal_size=512","shape":[64,256]}],"scalar_inputs":[]}},"dependencies":[],"opcode":"TLOAD","operands":[{"id":"block/0/tile/0xfffd835fd000","kind":"tile"},{"id":"block/0/tile/0x0","kind":"tile"}],"sequence_id":1}],"schema":"pto-trace","version":"0.2"}
