{"contract_epoch":"0.2","metadata":{"content_hash":"sha256:2ca5496aff126de3532252186dda9c25ec0a1a4a7c7b558311d93fe26d42be8e","data_layout":"davincioo-tile-address-v1","producer":"davincioo@e73633301cabed0d871ea5ff66e76a91df870aeb","pto_identity":"pto-isa@f6d0567c1cae2d6a7b0ebaf7ad0e3b93f8a39da3","record_count":6,"source_program":"examples/phase5/npu"},"records":[{"attributes":{"davincioo":{"block_idx":0,"input_tiles":[{"address":"0x100","dtype":"float32","layout":"ND","shape":[2,4]}],"operand_roles":["input_tile","output_tile"],"output_tiles":[{"address":"0x0","dtype":"float32","layout":"ND","shape":[2,4]}],"scalar_inputs":[]}},"dependencies":[],"opcode":"TLOAD","operands":[{"id":"block/0/tile/0x100","kind":"tile"},{"id":"block/0/tile/0x0","kind":"tile"}],"sequence_id":0},{"attributes":{"davincioo":{"block_idx":0,"input_tiles":[],"operand_roles":["scalar_input","output_tile"],"output_tiles":[{"address":"0x10","dtype":"float32","layout":"ND","shape":[2,4]}],"scalar_inputs":[{"dtype":"uint64","value":"7"}]}},"dependencies":[],"opcode":"TASSIGN","operands":[{"kind":"immediate","type":"uint64","value":"7"},{"id":"block/0/tile/0x10","kind":"tile"}],"sequence_id":1},{"attributes":{"davincioo":{"block_idx":0,"input_tiles":[{"address":"0x0","dtype":"float32","layout":"ND","shape":[2,4]},{"address":"0x10","dtype":"float32","layout":"ND","shape":[2,4]}],"operand_roles":["input_tile","input_tile","output_tile"],"output_tiles":[{"address":"0x20","dtype":"float32","layout":"ND","shape":[2,4]}],"scalar_inputs":[]}},"dependencies":[],"opcode":"TADD","operands":[{"id":"block/0/tile/0x0","kind":"tile"},{"id":"block/0/tile/0x10","kind":"tile"},{"id":"block/0/tile/0x20","kind":"tile"}],"sequence_id":2},{"attributes":{"davincioo":{"block_idx":0,"input_tiles":[{"address":"0x20","dtype":"float32","layout":"ND","shape":[2,4]}],"operand_roles":["input_tile","output_tile"],"output_tiles":[{"address":"0x40","dtype":"float32","layout":"ND","shape":[2,4]}],"scalar_inputs":[]}},"dependencies":[],"opcode":"TMATMUL","operands":[{"id":"block/0/tile/0x20","kind":"tile"},{"id":"block/0/tile/0x40","kind":"tile"}],"sequence_id":3},{"attributes":{"davincioo":{"block_idx":0,"input_tiles":[],"operand_roles":["output_tile"],"output_tiles":[{"address":"0x50","dtype":"float32","layout":"ND","shape":[2,4]}],"scalar_inputs":[]}},"dependencies":[],"opcode":"TADD","operands":[{"id":"block/0/tile/0x50","kind":"tile"}],"sequence_id":4},{"attributes":{"davincioo":{"block_idx":0,"input_tiles":[{"address":"0x40","dtype":"float32","layout":"ND","shape":[2,4]}],"operand_roles":["input_tile","output_tile"],"output_tiles":[{"address":"0x200","dtype":"float32","layout":"ND","shape":[2,4]}],"scalar_inputs":[]}},"dependencies":[],"opcode":"TSTORE","operands":[{"id":"block/0/tile/0x40","kind":"tile"},{"id":"block/0/tile/0x200","kind":"tile"}],"sequence_id":5}],"schema":"pto-trace","version":"0.2"}
